{
  "schema": "ardyn.phase-4-reviewer-handoff-index",
  "schemaVersion": "0.1.0",
  "indexPhase": "phase-4.0h-reviewer-handoff-index",
  "phaseIntroduced": "4.0H",
  "artifactKind": "phase_4_reviewer_handoff_index",
  "metadataGeneratedAt": "1970-01-01T00:00:00.000Z",
  "reviewRange": {
    "fromPhase": "4.0A",
    "throughPhase": "4.0H"
  },
  "runtimeStatus": "static-reviewer-index-only",
  "artifactCount": 37,
  "grantsRuntimeApproval": false,
  "runtimeBehaviorIntroduced": false,
  "liveRuntimeBehaviorIntroduced": false,
  "reviewMetadataOnly": true,
  "authoritativeRoles": [
    "normative-doc",
    "source-evidence"
  ],
  "evidenceOnlyRoles": [
    "test-evidence",
    "fixture-evidence",
    "display-only-evidence",
    "metadata-index"
  ],
  "safety": {
    "nonExecuting": true,
    "staticIndexOnly": true,
    "reviewOnly": true,
    "cliCommandAdded": false,
    "stdoutPrinterAdded": false,
    "fileWriterAdded": false,
    "runtimeBehaviorIntroduced": false,
    "liveRuntimeBehaviorIntroduced": false,
    "liveRuntimeApproved": false,
    "grantsRuntimeApproval": false,
    "stdinCommandLoop": false,
    "liveStdioReader": false,
    "processStdioOwnership": false,
    "listener": false,
    "server": false,
    "subprocessSpawning": false,
    "adapterCalls": false,
    "locusRuntimeDependency": false,
    "mcpCalls": false,
    "openClawCalls": false,
    "pluginExecution": false,
    "contentFabricRuntimeBehavior": false,
    "contentFabricDownloadInstallEnable": false,
    "autonomousLoop": false,
    "secretHandling": false,
    "productionSigningKeys": false,
    "transcriptPersistenceReplayRuntime": false,
    "webSocketHttpControlSurface": false,
    "runtimeExecution": false
  },
  "artifacts": [
    {
      "path": "docs/session-events-stdio-contract.md",
      "artifactKind": "stdio-contract-doc",
      "phaseIntroduced": "4.0A",
      "reviewPurpose": "Session-event schema and stdio contract baseline used by the finite dry-run emitter.",
      "runtimeStatus": "finite-dry-run-only",
      "evidenceRole": "normative-doc",
      "authoritative": true,
      "normative": true,
      "fixture": false,
      "docs": true,
      "displayOnlyEvidence": false,
      "grantsRuntimeApproval": false,
      "runtimeBehaviorIntroduced": false
    },
    {
      "path": "docs/phase-4-stdio-dry-run-event-emission.md",
      "artifactKind": "dry-run-emitter-doc",
      "phaseIntroduced": "4.0A",
      "reviewPurpose": "Finite dry-run JSONL stdout and stderr diagnostics behavior for emit-session-events.",
      "runtimeStatus": "finite-dry-run-only",
      "evidenceRole": "normative-doc",
      "authoritative": true,
      "normative": true,
      "fixture": false,
      "docs": true,
      "displayOnlyEvidence": false,
      "grantsRuntimeApproval": false,
      "runtimeBehaviorIntroduced": false
    },
    {
      "path": "tests/session-event-schema.test.mjs",
      "artifactKind": "session-event-schema-test",
      "phaseIntroduced": "4.0A",
      "reviewPurpose": "Validates the session-event schema consumed by the dry-run JSONL stream.",
      "runtimeStatus": "finite-dry-run-only",
      "evidenceRole": "test-evidence",
      "authoritative": false,
      "normative": false,
      "fixture": false,
      "docs": false,
      "displayOnlyEvidence": false,
      "grantsRuntimeApproval": false,
      "runtimeBehaviorIntroduced": false
    },
    {
      "path": "tests/core-phase4-stdio-dry-run.test.mjs",
      "artifactKind": "dry-run-core-test",
      "phaseIntroduced": "4.0A",
      "reviewPurpose": "Pins core event construction, JSONL formatting, path guards, and non-execution flags.",
      "runtimeStatus": "finite-dry-run-only",
      "evidenceRole": "test-evidence",
      "authoritative": false,
      "normative": false,
      "fixture": false,
      "docs": false,
      "displayOnlyEvidence": false,
      "grantsRuntimeApproval": false,
      "runtimeBehaviorIntroduced": false
    },
    {
      "path": "tests/cli-phase4-stdio-dry-run.test.mjs",
      "artifactKind": "dry-run-cli-test",
      "phaseIntroduced": "4.0A",
      "reviewPurpose": "Pins CLI stdout/stderr split, safe failure paths, LF JSONL, and no side effects.",
      "runtimeStatus": "finite-dry-run-only",
      "evidenceRole": "test-evidence",
      "authoritative": false,
      "normative": false,
      "fixture": false,
      "docs": false,
      "displayOnlyEvidence": false,
      "grantsRuntimeApproval": false,
      "runtimeBehaviorIntroduced": false
    },
    {
      "path": "tests/fixtures/stdio-dry-run/phase4-0b-minimal-session-events.jsonl",
      "artifactKind": "golden-jsonl-fixture",
      "phaseIntroduced": "4.0B",
      "reviewPurpose": "Golden LF-only JSONL stream for the minimal successful dry-run emission.",
      "runtimeStatus": "finite-dry-run-only",
      "evidenceRole": "fixture-evidence",
      "authoritative": false,
      "normative": false,
      "fixture": true,
      "docs": false,
      "displayOnlyEvidence": false,
      "grantsRuntimeApproval": false,
      "runtimeBehaviorIntroduced": false
    },
    {
      "path": "docs/phase-4-0c-pre-runtime-transport-policy.md",
      "artifactKind": "transport-policy-doc",
      "phaseIntroduced": "4.0C",
      "reviewPurpose": "Pre-runtime stdout, stderr, framing, redaction, backpressure, and replay policy.",
      "runtimeStatus": "pre-runtime-policy-only",
      "evidenceRole": "normative-doc",
      "authoritative": true,
      "normative": true,
      "fixture": false,
      "docs": true,
      "displayOnlyEvidence": false,
      "grantsRuntimeApproval": false,
      "runtimeBehaviorIntroduced": false
    },
    {
      "path": "tests/phase4-0c-transport-policy.test.mjs",
      "artifactKind": "transport-policy-test",
      "phaseIntroduced": "4.0C",
      "reviewPurpose": "Pins static transport policy wording and source guards before live runtime work.",
      "runtimeStatus": "pre-runtime-policy-only",
      "evidenceRole": "test-evidence",
      "authoritative": false,
      "normative": false,
      "fixture": false,
      "docs": false,
      "displayOnlyEvidence": false,
      "grantsRuntimeApproval": false,
      "runtimeBehaviorIntroduced": false
    },
    {
      "path": "docs/phase-4-0d-rust-host-transport-policy-contracts.md",
      "artifactKind": "rust-host-contract-doc",
      "phaseIntroduced": "4.0D",
      "reviewPurpose": "Documents the Rust-host stdio transport policy contract types as inactive metadata.",
      "runtimeStatus": "pre-runtime-policy-only",
      "evidenceRole": "normative-doc",
      "authoritative": true,
      "normative": true,
      "fixture": false,
      "docs": true,
      "displayOnlyEvidence": false,
      "grantsRuntimeApproval": false,
      "runtimeBehaviorIntroduced": false
    },
    {
      "path": "crates/ardyn-host/src/lib.rs",
      "artifactKind": "rust-host-contract-source",
      "phaseIntroduced": "4.0D",
      "reviewPurpose": "Static Rust-host contract, policy metadata, review-record, and comparison-adjacent source evidence.",
      "runtimeStatus": "pre-runtime-policy-only",
      "evidenceRole": "source-evidence",
      "authoritative": true,
      "normative": true,
      "fixture": false,
      "docs": false,
      "displayOnlyEvidence": false,
      "grantsRuntimeApproval": false,
      "runtimeBehaviorIntroduced": false
    },
    {
      "path": "tests/phase4-0d-rust-host-policy-contracts.test.mjs",
      "artifactKind": "rust-host-contract-test",
      "phaseIntroduced": "4.0D",
      "reviewPurpose": "Pins the inactive Rust-host transport policy contract documentation and source guards.",
      "runtimeStatus": "pre-runtime-policy-only",
      "evidenceRole": "test-evidence",
      "authoritative": false,
      "normative": false,
      "fixture": false,
      "docs": false,
      "displayOnlyEvidence": false,
      "grantsRuntimeApproval": false,
      "runtimeBehaviorIntroduced": false
    },
    {
      "path": "docs/phase-4-0e-rust-host-policy-metadata.md",
      "artifactKind": "policy-metadata-doc",
      "phaseIntroduced": "4.0E",
      "reviewPurpose": "Documents deterministic review-only Rust-host policy metadata export.",
      "runtimeStatus": "pre-runtime-policy-only",
      "evidenceRole": "normative-doc",
      "authoritative": true,
      "normative": true,
      "fixture": false,
      "docs": true,
      "displayOnlyEvidence": false,
      "grantsRuntimeApproval": false,
      "runtimeBehaviorIntroduced": false
    },
    {
      "path": "tests/fixtures/host-policy/phase4-0e-stdio-transport-policy-metadata.json",
      "artifactKind": "policy-metadata-fixture",
      "phaseIntroduced": "4.0E",
      "reviewPurpose": "Golden deterministic policy metadata JSON export for reviewer inspection and digest mapping.",
      "runtimeStatus": "pre-runtime-policy-only",
      "evidenceRole": "fixture-evidence",
      "authoritative": false,
      "normative": false,
      "fixture": true,
      "docs": false,
      "displayOnlyEvidence": false,
      "grantsRuntimeApproval": false,
      "runtimeBehaviorIntroduced": false
    },
    {
      "path": "tests/phase4-0e-policy-metadata.test.mjs",
      "artifactKind": "policy-metadata-test",
      "phaseIntroduced": "4.0E",
      "reviewPurpose": "Pins policy metadata fixture bytes, Rust helpers, report inventory, and source guards.",
      "runtimeStatus": "pre-runtime-policy-only",
      "evidenceRole": "test-evidence",
      "authoritative": false,
      "normative": false,
      "fixture": false,
      "docs": false,
      "displayOnlyEvidence": false,
      "grantsRuntimeApproval": false,
      "runtimeBehaviorIntroduced": false
    },
    {
      "path": "docs/phase-4-0f-host-policy-review-records.md",
      "artifactKind": "host-policy-review-record-doc",
      "phaseIntroduced": "4.0F",
      "reviewPurpose": "Documents static host-policy review records and compatibility classes.",